{
  "id": "shared.newsletter-band",
  "kind": "shared",
  "title": "Newsletter band",
  "purpose": "Outline InlineCtaForm band with four corner brackets: H2, description and a single-field email catcher.",
  "semantic": {
    "id": "conversion.newsletter-band",
    "category": "CONVERSION"
  },
  "source": {
    "id": "NewsletterBand",
    "tag": "div",
    "file": "src/primitives/NewsletterBand.jsx",
    "lines": "6-42",
    "anchor": "export default function NewsletterBand"
  },
  "content": {
    "fields": {
      "title": {
        "type": "text",
        "maxWords": 4,
        "required": true,
        "budgetBasis": "observed 4 words in the default (src/primitives/NewsletterBand.jsx)",
        "evidenceLevel": "derived"
      },
      "description": {
        "type": "text",
        "maxWords": 22,
        "required": true,
        "budgetBasis": "observed 19 words in the default; spec L2-3 at 18px",
        "evidenceLevel": "derived"
      },
      "submitLabel": {
        "type": "text",
        "maxWords": 2,
        "required": true,
        "budgetBasis": "observed 2 words",
        "evidenceLevel": "derived"
      },
      "formEndpoint": {
        "type": "asset",
        "allowedRoles": [
          "form.endpoint-placeholder"
        ],
        "required": true,
        "altText": false
      }
    },
    "additionalProperties": false
  },
  "variants": [],
  "variantRequired": false,
  "variantRules": [],
  "constraints": {
    "maxPerPage": 1
  },
  "motion": {
    "patterns": [
      {
        "pattern": "none",
        "reducedMotionFallback": "not-applicable",
        "implementedInClone": true
      },
      {
        "pattern": "state-transition",
        "reducedMotionFallback": "transition-unchanged",
        "implementedInClone": true,
        "note": "button and link hover and focus colour transitions (.12s buttons, .15s links) are not gated"
      }
    ]
  },
  "responsive": {
    "breakpoints": [
      {
        "viewport": {
          "name": "mobile",
          "minWidth": 0,
          "maxWidth": 767,
          "measuredAt": 390
        },
        "layout": {
          "layout": "copy above form",
          "padding": "43px 16px",
          "cardPadding": "32px 21px"
        },
        "evidenceLevel": "inferred"
      },
      {
        "viewport": {
          "name": "tablet",
          "minWidth": 768,
          "maxWidth": 1023,
          "measuredAt": null
        },
        "layout": {
          "rule": "inherits the stacked mobile layout in the clone below 1024px; original never measured here",
          "switchesAtPx": 1024
        },
        "evidenceLevel": "inferred"
      },
      {
        "viewport": {
          "name": "desktop-narrow",
          "minWidth": 1024,
          "maxWidth": 1279,
          "measuredAt": null
        },
        "layout": {
          "rule": "same as desktop: the clone switches to the desktop layout at 1024; the original was not measured in this band",
          "switchesAtPx": 1024
        },
        "evidenceLevel": "inferred"
      },
      {
        "viewport": {
          "name": "desktop",
          "minWidth": 1024,
          "maxWidth": null,
          "measuredAt": 1440
        },
        "layout": {
          "card": "1152px, grid 503/503, gap 48, padding 48",
          "corners": "4 x 64px brackets outside the card corners"
        },
        "evidenceLevel": "measured"
      }
    ],
    "citations": [
      {
        "ref": "PAGES_SPEC.md:218-229",
        "anchor": "### 2.8 `InlineCtaForm`"
      },
      {
        "ref": "src/primitives/NewsletterBand.jsx:6-42",
        "anchor": "export default function NewsletterBand"
      }
    ]
  },
  "a11y": [
    "Email field is labelled; the form posts nowhere."
  ],
  "assetRoles": [
    "form.endpoint-placeholder"
  ],
  "generatedAssetRoles": [
    "form.endpoint-placeholder"
  ],
  "styleTokens": [
    "border.default",
    "role.h2-feature"
  ],
  "evidence": {
    "level": {
      "desktop": "measured",
      "mobile": "inferred",
      "tablet": "inferred"
    },
    "citations": [
      {
        "ref": "src/primitives/NewsletterBand.jsx:6-42",
        "anchor": "export default function NewsletterBand"
      },
      {
        "ref": "PAGES_SPEC.md:218-229",
        "anchor": "### 2.8 `InlineCtaForm`"
      }
    ],
    "notes": [
      "390 not measured on the original."
    ]
  },
  "scopeNotes": []
}
