{
  "id": "block.PeopleCarousel",
  "kind": "block",
  "title": "People carousel",
  "purpose": "Row of 240px advisor cards with photo, mono name and organisation on a #93aeff border.",
  "semantic": {
    "id": "proof.people-carousel",
    "category": "PROOF"
  },
  "source": {
    "id": "PeopleCarousel",
    "tag": "section",
    "file": "src/blocks/PeopleCarousel.jsx",
    "lines": "4-24",
    "anchor": "export default function PeopleCarousel"
  },
  "content": {
    "fields": {
      "title": {
        "type": "text",
        "maxWords": 5,
        "required": true,
        "budgetBasis": "observed-max 5 words over 1 instance(s) in the clone page definitions (thin evidence)",
        "evidenceLevel": "inferred"
      },
      "people": {
        "type": "list",
        "items": {
          "type": "object",
          "fields": {
            "name": {
              "type": "text",
              "maxWords": 3,
              "required": true,
              "budgetBasis": "observed-max 3 words over 6 instances in the clone page definitions",
              "evidenceLevel": "derived"
            },
            "organisation": {
              "type": "text",
              "maxWords": 3,
              "required": true,
              "budgetBasis": "observed-max 3 words over 6 instances in the clone page definitions",
              "evidenceLevel": "derived"
            },
            "photo": {
              "type": "asset",
              "allowedRoles": [
                "photo.person"
              ],
              "required": true,
              "altText": true
            }
          },
          "required": true
        },
        "minItems": 3,
        "required": true,
        "maxItems": 8
      }
    },
    "additionalProperties": false
  },
  "variants": [],
  "variantRequired": false,
  "variantRules": [],
  "constraints": {},
  "motion": {
    "patterns": [
      {
        "pattern": "none",
        "reducedMotionFallback": "not-applicable",
        "implementedInClone": true
      },
      {
        "pattern": "state-transition",
        "reducedMotionFallback": "transition-unchanged",
        "implementedInClone": true,
        "note": "button and link hover and focus colour transitions (.12s buttons, .15s links) are not gated"
      }
    ]
  },
  "responsive": {
    "breakpoints": [
      {
        "viewport": {
          "name": "mobile",
          "minWidth": 0,
          "maxWidth": 767,
          "measuredAt": 390
        },
        "layout": {
          "row": "scrolls horizontally"
        },
        "evidenceLevel": "inferred"
      },
      {
        "viewport": {
          "name": "tablet",
          "minWidth": 768,
          "maxWidth": 1023,
          "measuredAt": null
        },
        "layout": {
          "rule": "inherits the stacked mobile layout in the clone below 1024px; original never measured here",
          "switchesAtPx": 1024
        },
        "evidenceLevel": "inferred"
      },
      {
        "viewport": {
          "name": "desktop-narrow",
          "minWidth": 1024,
          "maxWidth": 1279,
          "measuredAt": null
        },
        "layout": {
          "rule": "same as desktop: the clone switches to the desktop layout at 1024; the original was not measured in this band",
          "switchesAtPx": 1024
        },
        "evidenceLevel": "inferred"
      },
      {
        "viewport": {
          "name": "desktop",
          "minWidth": 1024,
          "maxWidth": null,
          "measuredAt": 1440
        },
        "layout": {
          "card": "240px wide, image 238x209, gap 16"
        },
        "evidenceLevel": "measured"
      }
    ],
    "citations": [
      {
        "ref": "PAGES_SPEC.md:551-571",
        "anchor": "### 3.34 Other bespoke blocks"
      },
      {
        "ref": "src/blocks/PeopleCarousel.jsx:4-24",
        "anchor": "export default function PeopleCarousel"
      }
    ]
  },
  "a11y": [
    "Names are real placeholder names, photos are credited stock portraits."
  ],
  "assetRoles": [
    "photo.person"
  ],
  "generatedAssetRoles": [
    "avatar.fictional-placeholder"
  ],
  "styleTokens": [
    "border.strong"
  ],
  "evidence": {
    "level": {
      "desktop": "measured",
      "mobile": "inferred",
      "tablet": "inferred"
    },
    "citations": [
      {
        "ref": "src/blocks/PeopleCarousel.jsx:4-24",
        "anchor": "export default function PeopleCarousel"
      },
      {
        "ref": "PAGES_SPEC.md:551-571",
        "anchor": "### 3.34 Other bespoke blocks"
      }
    ],
    "notes": []
  },
  "scopeNotes": [
    "Advisor names are invented; real advisors are not reproduced."
  ]
}
