{
  "id": "lp.cta-slim",
  "kind": "page",
  "title": "LP slim CTA",
  "purpose": "64px gradient bar with a 21px semibold prompt and a mono button.",
  "semantic": {
    "id": "conversion.cta-slim",
    "category": "CONVERSION"
  },
  "source": {
    "id": "CtaSlim",
    "tag": "section",
    "file": "src/pages/content/DemoPages.jsx",
    "lines": "243-254",
    "anchor": "function CtaSlim()"
  },
  "content": {
    "fields": {
      "title": {
        "type": "text",
        "maxWords": 6,
        "required": true,
        "budgetBasis": "observed 5 words",
        "evidenceLevel": "derived"
      },
      "button": {
        "type": "link",
        "maxWords": 3,
        "required": true,
        "budgetBasis": "observed 2 words",
        "evidenceLevel": "derived"
      }
    },
    "additionalProperties": false
  },
  "variants": [],
  "variantRequired": false,
  "variantRules": [],
  "constraints": {
    "maxPerPage": 1
  },
  "motion": {
    "patterns": [
      {
        "pattern": "none",
        "reducedMotionFallback": "not-applicable",
        "implementedInClone": true
      },
      {
        "pattern": "state-transition",
        "reducedMotionFallback": "transition-unchanged",
        "implementedInClone": true,
        "note": "button and link hover and focus colour transitions (.12s buttons, .15s links) are not gated"
      }
    ]
  },
  "responsive": {
    "breakpoints": [
      {
        "viewport": {
          "name": "mobile",
          "minWidth": 0,
          "maxWidth": 767,
          "measuredAt": 390
        },
        "layout": {
          "layout": "stacked"
        },
        "evidenceLevel": "inferred"
      },
      {
        "viewport": {
          "name": "tablet",
          "minWidth": 768,
          "maxWidth": 1023,
          "measuredAt": null
        },
        "layout": {
          "rule": "inherits the stacked mobile layout in the clone below 1024px; original never measured here",
          "switchesAtPx": 1024
        },
        "evidenceLevel": "inferred"
      },
      {
        "viewport": {
          "name": "desktop-narrow",
          "minWidth": 1024,
          "maxWidth": 1279,
          "measuredAt": null
        },
        "layout": {
          "rule": "same as desktop: the clone switches to the desktop layout at 1024; the original was not measured in this band",
          "switchesAtPx": 1024
        },
        "evidenceLevel": "inferred"
      },
      {
        "viewport": {
          "name": "desktop",
          "minWidth": 1024,
          "maxWidth": null,
          "measuredAt": 1440
        },
        "layout": {
          "bar": "1152x64 radius 6 gradient #e2f5fa to #265cff"
        },
        "evidenceLevel": "measured"
      }
    ],
    "citations": [
      {
        "ref": "PAGES_SPEC.md:511-527",
        "anchor": "### 3.32 LP-only blocks"
      }
    ]
  },
  "a11y": [
    "The button anchors to the on-page form."
  ],
  "assetRoles": [],
  "generatedAssetRoles": [],
  "styleTokens": [
    "text.heading-navy"
  ],
  "evidence": {
    "level": {
      "desktop": "measured",
      "mobile": "inferred",
      "tablet": "inferred"
    },
    "citations": [
      {
        "ref": "src/pages/content/DemoPages.jsx:243-254",
        "anchor": "function CtaSlim()"
      }
    ],
    "notes": []
  },
  "scopeNotes": []
}
